Symbol,Name,Last Sale,Net Change,% Change,Market Cap,Country,IPO Year,Volume,Sector,Industry
IH,iHuman Inc. American depositary shares each representing five Class A ordinary shares,$10.74,-0.41,-3.677%,572704872.00,United States,2020,24487,Consumer Services,Other Consumer Services
IHC,Independence Holding Company Common Stock,$45.00,-0.04,-0.089%,658775205.00,United States,,9999,Finance,Life Insurance
IHD,Voya Emerging Markets High Income Dividend Equity Fund Common Shares,$7.99,0.12,1.525%,148033263.00,United States,2011,72714,Finance,Investment Managers
IHG,Intercontinental Hotels Group American Depositary Shares (Each representing one Ordinary Share),$64.61,-1.16,-1.764%,11837605918.00,United Kingdom,,68303,Consumer Services,Hotels/Resorts
IHIT,Invesco High Income 2023 Target Term Fund Common Shares of Beneficial Interest,$9.95,0.05,0.505%,239566041.00,United States,2016,199299,Finance,Investment Managers
IHTA,Invesco High Income 2024 Target Term Fund Common Shares of Beneficial Interest No par value per share,$9.96,0.08,0.81%,87466818.00,,2017,34895,Finance,Finance/Investors Services
IIAC,Investindustrial Acquisition Corp. Class A Ordinary Shares,$9.84,0.0536,0.548%,495075000.00,United Kingdom,2021,29939,Finance,Business Services
IIF,Morgan Stanley India Investment Fund Inc. Common Stock,$24.80,-0.10,-0.402%,279600284.00,United States,1994,8390,Finance,Trusts Except Educational Religious and Charitable
IIIN,Insteel Industries Inc. Common Stock,$33.07,-0.92,-2.707%,639595097.00,United States,,74274,,
IIM,Invesco Value Municipal Income Trust Common Stock,$16.76,0.00,0.00%,788667242.00,United States,,81701,Finance,Investment Managers
IIPR,Innovative Industrial Properties Inc. Common Stock,$208.19,0.39,0.188%,4981219936.00,United States,2016,239132,Consumer Services,Real Estate
IIPR^A,Innovative Industrial Properties Inc. 9.00% Series A Cumulative Redeemable Preferred Stock,$35.25,0.0084,0.024%,,United States,,2161,,
IMAX,Imax Corporation Common Stock,$18.42,-0.82,-4.262%,1093386867.00,Canada,,496138,Miscellaneous,Industrial Machinery/Components
IMPX,AEA-Bridges Impact Corp. Class A Ordinary Shares,$9.75,0.00,0.00%,487500000.00,,2020,10541,Finance,Business Services
INFO,IHS Markit Ltd. Common Shares,$111.66,-0.80,-0.711%,44509048525.00,Bermuda,1996,3443100,Technology,EDP Services
INFY,Infosys Limited American Depositary Shares,$21.05,0.00,0.00%,89373185503.00,India,,8867409,Technology,EDP Services
ING,ING Group N.V. Common Stock,$12.63,-0.30,-2.32%,49299039574.00,Netherlands,1997,3676870,Finance,Commercial Banks
INGR,Ingredion Incorporated Common Stock,$87.71,-2.53,-2.804%,5874416544.00,United States,,376090,Consumer Non-Durables,Textiles
INN,Summit Hotel Properties Inc. Common Stock,$9.05,-0.29,-3.105%,960396987.00,United States,2011,622476,Consumer Services,Real Estate Investment Trusts
INN^D,Summit Hotel Properties Inc. 6.45% Series D Cumulative Redeemable Preferred Stock,$25.45,0.0851,0.336%,,United States,,13301,,
INN^E,Summit Hotel Properties Inc. 6.250% Series E Cumulative Redeemable Preferred Stock,$26.00,-0.20,-0.763%,,United States,,7584,,
INS,Intelligent Systems Corporation Common Stock,$31.07,-0.73,-2.296%,275974615.00,United States,1992,33883,Technology,Computer Software: Prepackaged Software
INSI,Insight Select Income Fund,$21.20,-0.15,-0.703%,227052742.00,United States,,14950,Finance,Investment Managers
INSP,Inspire Medical Systems Inc. Common Stock,$187.70,2.50,1.35%,5107979206.00,United States,1998,186058,Health Care,Biotechnology: Electromedical & Electrotherapeutic Apparatus
INSW,International Seaways Inc. Common Stock ,$18.25,-0.73,-3.846%,512587951.00,,2016,288795,Technology,Semiconductors
INSW^A,International Seaways Inc. 8.50% Senior Notes due June 30 2023,$25.88,0.03,0.116%,,,,193,,
INT,World Fuel Services Corporation Common Stock,$30.30,-0.45,-1.463%,1916021409.00,United States,,245481,Energy,Oil Refining/Marketing
INVH,Invitation Homes Inc. Common Stock,$39.62,-0.47,-1.172%,22490310195.00,United States,2017,3047785,Consumer Services,Real Estate Investment Trusts
IO,Ion Geophysical Corporation Common Stock,$1.73,-0.06,-3.352%,49843388.00,United States,,380958,Energy,Oilfield Services/Equipment
IP,International Paper Company Common Stock,$61.44,-0.79,-1.269%,24068461609.00,United States,,1382044,Basic Industries,Containers/Packaging
IPG,Interpublic Group of Companies Inc. (The) Common Stock,$32.36,-0.64,-1.939%,12729635969.00,United States,,2518444,Technology,Advertising
IPI,Intrepid Potash Inc Common Stock,$31.89,-0.40,-1.239%,428786658.00,United States,2008,71328,Basic Industries,Major Chemicals
IPOD,Social Capital Hedosophia Holdings Corp. IV Class A Ordinary Shares,$10.23,-0.05,-0.486%,588225000.00,United States,2020,290038,Finance,Business Services
IPOF,Social Capital Hedosophia Holdings Corp. VI Class A Ordinary Shares,$10.08,-0.07,-0.69%,1449000000.00,United States,2020,1141776,Finance,Business Services
IPVA,InterPrivate II Acquisition Corp. Class A Common Stock,$9.69,-0.0126,-0.13%,313410938.00,,2021,7930,,
IPVF,InterPrivate III Financial Partners Inc. Class A Common Stock,$9.75,0.0229,0.235%,315351563.00,,2021,100,Finance,Business Services
IQI,Invesco Quality Municipal Income Trust Common Stock,$13.66,-0.04,-0.292%,722392667.00,United States,,61932,Finance,Finance Companies
IQV,IQVIA Holdings Inc. Common Stock,$249.63,1.01,0.406%,47844378866.00,United States,2013,734752,Health Care,Biotechnology: Commercial Physical & Biological Resarch
IR,Ingersoll Rand Inc. Common Stock,$48.58,-0.80,-1.62%,20377017073.00,United States,2017,1358263,Capital Goods,Industrial Machinery/Components
IRL,New Ireland Fund Inc (The) Common Stock,$12.35,-0.015,-0.121%,59937045.00,United States,1990,9603,Finance,Trusts Except Educational Religious and Charitable
IRM,Iron Mountain Incorporated (Delaware)Common Stock REIT,$44.20,-0.30,-0.674%,12761914222.00,United States,,3089238,Consumer Services,Real Estate Investment Trusts
IRS,IRSA Inversiones Y Representaciones S.A. Common Stock,$4.80,0.19,4.121%,277793587.00,Argentina,,88162,Consumer Services,Homebuilding
IRT,Independence Realty Trust Inc. Common Stock,$19.02,-0.25,-1.297%,1942845678.00,United States,2013,355256,Consumer Services,Real Estate Investment Trusts
IS,ironSource Ltd. Class A Ordinary Shares,$10.02,-0.25,-2.434%,0.00,,2021,1930766,,
ISD,PGIM High Yield Bond Fund Inc.,$16.35,-0.02,-0.122%,543747454.00,United States,2012,141889,Finance,Trusts Except Educational Religious and Charitable
ISOS,Isos Acquisition Corporation Class A Ordinary Shares,$9.925,0.005,0.05%,316158146.00,,2021,225749,,
IT,Gartner Inc. Common Stock,$255.67,-0.97,-0.378%,22007186169.00,United States,1993,420314,Finance,Diversified Commercial Services
ITCB,Itau CorpBanca American Depositary Shares (each representing 1500 shares of Common Stock no par value),$4.04,0.00,0.00%,1380082204.00,Chile,,9173,Finance,Commercial Banks
ITGR,Integer Holdings Corporation Common Stock,$90.67,-2.41,-2.589%,2989850957.00,United States,,101190,Health Care,Medical/Dental Instruments
ITT,ITT Inc. Common Stock ,$94.69,-0.54,-0.567%,8152809000.00,United States,2011,360144,Capital Goods,Fluid Controls
ITUB,Itau Unibanco Banco Holding SA American Depositary Shares (Each repstg 500 Preferred shares),$5.71,0.02,0.351%,55981612837.00,Brazil,,48781402,Finance,Major Banks
ITW,Illinois Tool Works Inc. Common Stock,$227.47,0.00,0.00%,71853845048.00,United States,,800555,Capital Goods,Industrial Machinery/Components
IVAN,Ivanhoe Capital Acquisition Corp. Class A Ordinary Shares,$10.01,-0.45,-4.302%,345345000.00,,2021,5974868,Finance,Business Services
IVC,Invacare Corporation Common Stock,$8.04,-0.34,-4.057%,281039712.00,United States,,424383,Health Care,Industrial Specialties
IVH,Delaware Ivy High Income Opportunities Fund,$13.96,0.06,0.432%,231317200.00,,2013,97322,Finance,Investment Managers
IVR,INVESCO MORTGAGE CAPITAL INC Common Stock,$3.39,-0.11,-3.143%,962413237.00,United States,2009,6460742,Consumer Services,Real Estate Investment Trusts
IVR^B,Invesco Mortgage Capital Inc. Preferred Series B Cum Fxd to Fltg,$25.00,0.00,0.00%,,United States,,12908,,
IVR^C,INVESCO MORTGAGE CAPITAL INC 7.5% Fixed-to-Floating Series C Cumulative Redeemable Preferred Stock Liquation Preference $25.00 per Share,$25.03,-0.01,-0.04%,,United States,,21613,,
IVZ,Invesco Ltd Common Stock,$26.43,-0.28,-1.048%,12196152282.00,United States,,3801270,Finance,Investment Managers
IX,Orix Corp Ads Common Stock,$86.49,0.50,0.581%,19875606203.00,Japan,,21789,Finance,Diversified Financial Services
J,Jacobs Engineering Group Inc. Common Stock,$132.89,-2.65,-1.955%,17304323576.00,United States,,412220,Capital Goods,Oilfield Services/Equipment
JAX,J. Alexander's Holdings Inc. Common Stock,$13.74,0.00,0.00%,207337658.00,,2015,259490,Consumer Services,Restaurants
JBGS,JBG SMITH Properties Common Shares ,$32.06,-0.42,-1.293%,4215862717.00,United States,2017,546321,Consumer Services,Real Estate Investment Trusts
JBI,Janus International Group Inc. Common Stock,$12.96,-0.17,-1.295%,558900000.00,,2021,266622,,
JBK,Lehman ABS 3.50 3.50% Adjustable Corp Backed Tr Certs GS Cap I,$31.63,0.17,0.54%,0.00,United States,,1230,Finance,Trusts Except Educational Religious and Charitable
JBL,Jabil Inc. Common Stock,$57.08,-0.86,-1.484%,8493387728.00,United States,1993,448975,Technology,Electrical Products
JBT,John Bean Technologies Corporation Common Stock,$133.90,-1.94,-1.428%,4251369857.00,United States,,237216,Capital Goods,Diversified Manufacture
JCE,Nuveen Core Equity Alpha Fund Nuveen Core Equity Alpha Fund Common Shares of Beneficial Interest,$16.79,0.15,0.901%,269131628.00,United States,2007,134329,Finance,Trusts Except Educational Religious and Charitable
JCI,Johnson Controls International plc Ordinary Share,$69.62,-1.07,-1.514%,49897704635.00,Switzerland,,3523190,Capital Goods,Industrial Machinery/Components
JCO,Nuveen Credit Opportunities 2022 Target Term Fund Common Shares of Beneficial Interest,$8.34,0.00,0.00%,231439103.00,United States,2017,37743,Finance,Trusts Except Educational Religious and Charitable
JDD,Nuveen Diversified Dividend and Income Fund Shares of Beneficial Interest,$10.65,0.05,0.472%,209469706.00,United States,2003,19453,Finance,Finance Companies
JEF,Jefferies Financial Group Inc. Common Stock,$31.92,-0.44,-1.36%,7883358785.00,United States,,1659220,Finance,Finance/Investors Services
JELD,JELD-WEN Holding Inc. Common Stock,$24.80,-0.73,-2.859%,2459276599.00,United States,2017,434958,,
JEMD,Nuveen Emerging Markets Debt 2022 Target Term Fund Common Shares of Beneficial Interest $0.01 par value per share,$8.16,0.0105,0.129%,116255455.00,,2017,5394,Finance,Investment Managers
JEQ,Aberdeen Japan Equity Fund Inc.  Common Stock,$8.88,-0.03,-0.337%,119067791.00,United States,1992,18765,Finance,Finance Companies
JFR,Nuveen Floating Rate Income Fund Common Stock,$9.95,0.02,0.201%,566338757.00,United States,2004,338789,Finance,Trusts Except Educational Religious and Charitable
JGH,Nuveen Global High Income Fund Common Shares of Beneficial Interest,$16.26,0.05,0.308%,376864410.00,United States,2014,65727,Finance,Investment Managers
JHAA,Nuveen Corporate Income 2023 Target Term Fund,$9.97,0.0101,0.101%,78019826.00,,2018,27483,Finance,Finance/Investors Services
JHB,Nuveen Corporate Income November 2021 Target Term Fund,$9.42,0.00,0.00%,526578462.00,,2016,84379,Finance,Investment Managers
JHG,Janus Henderson Group plc Ordinary Shares,$40.34,-0.52,-1.273%,6952598556.00,,2017,1863121,Finance,Investment Managers
JHI,John Hancock Investors Trust Common Stock,$18.84,-0.0628,-0.332%,164040351.00,United States,,12114,Finance,Trusts Except Educational Religious and Charitable
JHS,John Hancock Income Securities Trust Common Stock,$15.83,-0.12,-0.752%,184365425.00,United States,,18881,Finance,Finance Companies
JHX,James Hardie Industries plc American Depositary Shares (Ireland),$33.63,-0.19,-0.562%,14941434833.00,Ireland,,93157,Capital Goods,Building Materials
JILL,J. Jill Inc. Common Stock,$21.51,0.93,4.519%,214752377.00,,2017,211532,Consumer Services,Clothing/Shoe/Accessory Stores
JKS,JinkoSolar Holding Company Limited American Depositary Shares (each representing 4 Common Shares),$61.78,-0.12,-0.194%,2945604172.00,China,2010,1806543,Technology,Semiconductors
JLL,Jones Lang LaSalle Incorporated Common Stock,$190.92,-4.10,-2.102%,9795564896.00,United States,,576550,Finance,Real Estate
JLS,Nuveen Mortgage and Income Fund,$21.095,0.025,0.119%,115757547.00,United States,2009,13878,Finance,Investment Managers
JMIA,Jumia Technologies AG American Depositary Shares each representing two Ordinary Shares,$24.62,-0.93,-3.64%,2427349418.00,,2019,2667116,Consumer Services,Catalog/Specialty Distribution
JMM,Nuveen Multi-Market Income Fund (MA),$7.48,0.01,0.134%,70778385.00,United States,,3638,Finance,Trusts Except Educational Religious and Charitable
JMP,JMP Group LLC Common Shares,$6.175,-0.025,-0.403%,122589144.00,United States,2007,18395,Finance,Investment Bankers/Brokers/Service
JNJ,Johnson & Johnson Common Stock,$169.27,-0.21,-0.124%,445754941428.00,United States,,4690458,Health Care,Major Pharmaceuticals
JNPR,Juniper Networks Inc. Common Stock,$27.45,0.13,0.476%,8996466294.00,United States,1999,5028157,Technology,Computer peripheral equipment
JOE,St. Joe Company (The) Common Stock,$42.61,-1.26,-2.872%,2508985413.00,United States,,192118,Consumer Services,Homebuilding
JOF,Japan Smaller Capitalization Fund Inc Common Stock,$9.04,0.07,0.78%,256138393.00,United States,1990,33042,Finance,Trusts Except Educational Religious and Charitable
JP,Jupai Holdings Limited American Depositary Shares each representing six ordinary shares,$1.50,-0.05,-3.226%,49837761.00,,2015,76196,Consumer Services,Other Consumer Services
JPC,Nuveen Preferred & Income Opportunities Fund,$10.03,-0.02,-0.199%,1036652144.00,United States,2003,333104,Finance,Investment Managers
JPI,Nuveen Preferred and Income Term Fund Common Shares of Beneficial Interest,$26.13,0.2598,1.004%,594755147.00,,2012,47859,Finance,Finance Companies
JPM,JP Morgan Chase & Co. Common Stock,$155.65,-2.35,-1.487%,471172490633.00,United States,,22666037,Finance,Major Banks
JPM^C,J P Morgan Chase & Co Depositary Shares each representing a 1/400th interest in a share of 6.00% Non-Cumulative  Preferred Stock Series EE,$28.57,-0.05,-0.175%,,United States,,131745,,
JPM^D,J P Morgan Chase & Co Depositary Shares each representing a 1/400th  interest in a share of 5.75% Non-Cumulative  Preferred Stock Series DD,$28.30,-0.05,-0.176%,,United States,,170129,,
JPM^J,J P Morgan Chase & Co Depositary Shares each representing a 1/400th interest in a share of JPMorgan Chase & Co. 4.75% Non-Cumulative Preferred Stock Series GG,$27.34,-0.14,-0.509%,,United States,,70514,,
JPM^K,J P Morgan Chase & Co Depositary Shares each representing a 1/400th interest in a share of 4.55% Non-Cumulative Preferred Stock Series JJ,$26.55,-0.05,-0.188%,,United States,,329013,,
JPM^L,J P Morgan Chase & Co Depositary Shares each representing a 1/400th interest in a share of 4.625% Non-Cumulative Preferred Stock Series LL,$26.61,-0.04,-0.15%,,United States,,508882,,
JPS,Nuveen Preferred & Income Securities Fund,$10.06,0.02,0.199%,2050128879.00,United States,2002,467846,Finance,Investment Managers
JPT,Nuveen Preferred and Income 2022 Term Fund Common Shares of Beneficial Interest,$25.245,-0.05,-0.198%,172702863.00,United States,2017,10670,Finance,Trusts Except Educational Religious and Charitable
JQC,Nuveen Credit Strategies Income Fund Shares of Beneficial Interest,$6.63,-0.01,-0.151%,899089593.00,United States,2003,1160936,Finance,Finance Companies
JRI,Nuveen Real Asset Income and Growth Fund Common Shares of Beneficial Interest,$16.18,-0.08,-0.492%,444200542.00,United States,2012,43024,Finance,Finance Companies
JRO,Nuveen Floating Rate Income Opportuntiy Fund Shares of Beneficial Interest,$9.77,-0.01,-0.102%,396087700.00,United States,2004,171130,Finance,Investment Managers
JRS,Nuveen Real Estate Income Fund Common Shares of Beneficial Interest,$11.47,-0.05,-0.434%,331396642.00,United States,2001,92565,Finance,Finance/Investors Services
JSD,Nuveen Short Duration Credit Opportunities Fund Common Shares of Beneficial Interest,$14.78,-0.04,-0.27%,149065877.00,United States,2011,50194,Finance,Finance Companies
JT,Jianpu Technology Inc. American depositary shares,$2.13,-0.10,-4.484%,45116327.00,,2017,87571,Technology,EDP Services
JTA,Nuveen Tax-Advantaged Total Return Strategy Fund Common Share of Beneficial Interest,$11.72,0.12,1.034%,162332513.00,United States,2004,135392,Finance,Finance Companies
JTD,Nuveen Tax-Advantaged Dividend Growth Fund Common Shares of Beneficial Interest,$16.14,0.09,0.561%,233777248.00,United States,,23292,Finance,Trusts Except Educational Religious and Charitable
JW/A,John Wiley & Sons Inc.,$58.20,-0.76,-1.289%,,United States,,279747,,
JW/B,John Wiley & Sons Inc.,$59.29,0.00,0.00%,,United States,,3,,
JWN,Nordstrom Inc. Common Stock,$34.85,-1.45,-3.994%,5537618859.00,United States,,2252944,Consumer Services,Clothing/Shoe/Accessory Stores
JWSM,Jaws Mustang Acquisition Corp. Class A Ordinary Shares,$9.79,0.005,0.051%,1266581250.00,,2021,71518,Finance,Business Services
K,Kellogg Company Common Stock,$63.16,-0.61,-0.957%,21505748582.00,United States,,1951927,Consumer Non-Durables,Packaged Foods
KAHC,KKR Acquisition Holdings I Corp. Class A Common Stock,$9.76,0.00,0.00%,1683600000.00,,2021,12856,,
KAI,Kadant Inc Common Stock,$179.56,0.75,0.419%,2078906177.00,United States,,29808,Technology,Industrial Machinery/Components
KAMN,Kaman Corporation Common Stock,$47.34,-0.43,-0.90%,1316528051.00,United States,,95121,Capital Goods,Military/Government/Technical
KAR,KAR Auction Services Inc Common Stock,$16.10,-0.72,-4.281%,2008653710.00,United States,2009,1351160,,
KB,KB Financial Group Inc,$45.60,-0.12,-0.262%,17767325676.00,South Korea,,333005,Finance,Commercial Banks
KBH,KB Home Common Stock,$38.78,-1.16,-2.904%,3830818003.00,United States,1986,2024978,Capital Goods,Homebuilding
KBR,KBR Inc. Common Stock,$38.98,-0.49,-1.241%,5509674837.00,United States,2006,904738,Basic Industries,Military/Government/Technical
KCAC,Kensington Capital Acquisition Corp. II Class A Common Stock,$9.95,-0.03,-0.301%,286062500.00,,2021,75875,Finance,Business Services
KEN,Kenon Holdings Ltd. Ordinary Shares,$33.36,-0.49,-1.448%,1797407343.00,Singapore,2015,27527,Public Utilities,Electric Utilities: Central
KEP,Korea Electric Power Corporation Common Stock,$10.69,-0.05,-0.466%,13725191966.00,South Korea,1994,111993,Consumer Durables,Electrical Products
KEX,Kirby Corporation Common Stock,$59.02,-1.35,-2.236%,3547397100.00,United States,,216299,Transportation,Marine Transportation
KEY,KeyCorp Common Stock,$20.07,-0.35,-1.714%,19478325121.00,United States,,5350278,Finance,Major Banks
KEY^I,KeyCorp Depositary Shares Each Representing a 1/40th Ownership Interest in a Share of Fixed-to-Floating Rate Perpetual Non-Cumulative Preferred Stock Series E,$30.19,-0.15,-0.494%,,United States,,39091,,
KEY^J,KeyCorp Depositary Shares each representing a 1/40th ownership interest in a share of Fixed Rate Perpetual Non-Cumulative Preferred Stock Series F,$27.41,-0.20,-0.724%,,United States,,27418,,
KEY^K,KeyCorp Depositary Shares each representing a 1/40th ownership interest in a share of Fixed Rate Perpetual Non-Cumulative Preferred Stock Series G,$28.20,-0.10,-0.353%,,United States,,47380,,
KEYS,Keysight Technologies Inc. Common Stock,$157.42,-0.30,-0.19%,29000854716.00,United States,2014,743204,Capital Goods,Industrial Machinery/Components
KF,Korea Fund Inc. (The) New Common Stock,$45.04,0.07,0.156%,226099719.00,United States,,1039,Finance,Investment Managers
KFS,Kingsway Financial Services Inc. Common Stock (DE),$5.029,0.049,0.984%,119215618.00,Canada,,26188,,
KFY,Korn Ferry Common Stock,$67.86,-1.16,-1.681%,3664982880.00,United States,1999,223760,Technology,Diversified Commercial Services
KGC,Kinross Gold Corporation Common Stock,$6.28,0.09,1.454%,7920336000.00,Canada,,14943365,Basic Industries,Precious Metals
KIM,Kimco Realty Corporation Common Stock,$20.97,-0.45,-2.101%,9090825823.00,United States,,3504775,Consumer Services,Real Estate Investment Trusts
KIM^L,Kimco Realty Corporation Class L Depositary Shares each of which represents a one-one thousandth fractional interest in a share of 5.125% Class L Cumulative Redeemable Preferred Stock liquidation preference $25000.00 per share,$25.95,-0.19,-0.727%,,United States,,6939,,
KIM^M,Kimco Realty Corporation Class M Depositary Shares each of which represents a one-one thousandth fractional interest in a share of 5.25% Class M Cumulative Redeemable Preferred Stock liquidation preference $25000.00 per share,$26.86,0.02,0.075%,,United States,,12322,,
KIO,KKR Income Opportunities Fund Common Shares,$16.49,-0.01,-0.061%,335411794.00,,2013,50922,Finance,Investment Managers
KKR,KKR & Co. Inc. Common Stock,$59.41,-1.05,-1.737%,34563475240.00,United States,,1110624,Finance,Investment Managers
KKR^B,KKR & Co. Inc. 6.50% Series B Preferred Stock,$25.33,-0.05,-0.197%,,United States,,8776,,
KKR^C,KKR & Co. Inc. 6.00% Series C Mandatory Convertible Preferred Stock,$77.01,-1.54,-1.961%,,United States,,162078,,
KKRS,KKR Group Finance Co. IX LLC 4.625% Subordinated Notes due 2061,$25.85,-0.16,-0.615%,0.00,,2021,41943,,
KL,Kirkland Lake Gold Ltd. Common Shares,$40.88,1.19,2.998%,10918347889.00,,,1746242,Basic Industries,Precious Metals
KMB,Kimberly-Clark Corporation Common Stock,$134.34,-0.36,-0.267%,45330559532.00,United States,,1752278,Basic Industries,Paper
KMF,Kayne Anderson NextGen Energy & Infrastructure Inc.,$7.53,-0.12,-1.569%,355396889.00,,2010,195526,Finance,Investment Managers
KMI,Kinder Morgan Inc. Common Stock,$18.28,-0.24,-1.296%,41396569617.00,United States,2011,9133490,Public Utilities,Natural Gas Distribution
KMPR,Kemper Corporation,$70.22,-1.39,-1.941%,4533860051.00,United States,,132810,Finance,Life Insurance
KMT,Kennametal Inc. Common Stock,$35.41,-0.74,-2.047%,2960228161.00,United States,,402252,Capital Goods,Industrial Machinery/Components
KMX,CarMax Inc,$131.74,-3.68,-2.717%,21465064409.00,United States,,1407945,Consumer Services,Other Specialty Stores
KN,Knowles Corporation Common Stock,$19.99,0.29,1.472%,1854941066.00,,2014,999860,Consumer Non-Durables,Consumer Electronics/Appliances
KNL,Knoll Inc. Common Stock,$25.51,-0.45,-1.733%,1296959216.00,United States,2004,903592,Consumer Durables,Office Equipment/Supplies/Services
KNOP,KNOT Offshore Partners LP Common Units representing Limited Partner Interests,$19.68,-0.17,-0.856%,643419770.00,United Kingdom,2013,108385,Transportation,Marine Transportation
KNX,Knight-Swift Transportation Holdings Inc.,$49.92,0.30,0.605%,8262292047.00,United States,2017,1299747,Transportation,Trucking Freight/Courier Services
KO,Coca-Cola Company (The) Common Stock,$55.02,0.54,0.991%,237198313398.00,United States,,15145683,Consumer Non-Durables,Beverages (Production/Distribution)
KODK,Eastman Kodak Company Common New,$7.69,-0.29,-3.634%,603691730.00,United States,,1046230,Miscellaneous,Business Services
KOF,Coca Cola Femsa S.A.B. de C.V.  American Depositary Shares each representing 10 Units (each Unit consists of 3 Series B Shares and 5 Series L Shares),$51.99,-0.93,-1.757%,10922226920.00,Mexico,1993,104146,Consumer Non-Durables,Beverages (Production/Distribution)
KOP,Koppers Holdings Inc. Koppers Holdings Inc. Common Stock,$30.78,-0.68,-2.161%,653793702.00,United States,2006,75537,Basic Industries,Industrial Specialties
KOS,Kosmos Energy Ltd. Common Shares (DE),$2.80,-0.16,-5.405%,1142535282.00,Bermuda,2011,8667139,Energy,Oil & Gas Production
KR,Kroger Company (The) Common Stock,$38.07,-0.24,-0.626%,28447353668.00,United States,,4576649,Consumer Services,Food Chains
KRA,Kraton Corporation Common Stock,$39.16,-1.18,-2.925%,1258760881.00,United States,2009,266416,Basic Industries,Major Chemicals
KRC,Kilroy Realty Corporation Common Stock,$70.46,-1.42,-1.976%,8205093070.00,United States,1997,507679,Consumer Services,Real Estate Investment Trusts
KREF,KKR Real Estate Finance Trust Inc. Common Stock,$21.12,-0.35,-1.63%,1175063578.00,United States,2017,287235,Consumer Services,Real Estate Investment Trusts
KREF^A,KKR Real Estate Finance Trust Inc. 6.50% Series A Cumulative Redeemable Preferred Stock,$27.08,-0.0234,-0.086%,,United States,,6206,,
KRG,Kite Realty Group Trust Common Stock,$21.34,-0.56,-2.557%,1802920143.00,United States,2004,274120,Consumer Services,Real Estate Investment Trusts
KRO,Kronos Worldwide Inc Common Stock,$14.16,-0.12,-0.84%,1636084873.00,United States,,124269,Basic Industries,Major Chemicals
KRP,Kimbell Royalty Partners Common Units Representing Limited Partner Interests,$12.45,-0.12,-0.955%,748022867.00,United States,2017,350819,Energy,Oil & Gas Production
KSM,DWS Strategic Municipal Income Trust,$12.52,-0.13,-1.028%,140273341.00,United States,1989,26635,Finance,Trusts Except Educational Religious and Charitable
KSS,Kohl's Corporation Common Stock,$52.55,-1.53,-2.829%,8210046725.00,United States,1992,2760999,Consumer Services,Department/Specialty Retail Stores
KSU,Kansas City Southern Common Stock,$268.51,-1.90,-0.703%,24482772410.00,United States,,536949,Transportation,Railroads
KSU^,Kansas City Southern Preferred Stock,$37.00,0.08,0.217%,,United States,,20,,
KT,KT Corporation Common Stock,$14.23,0.09,0.636%,6666505804.00,South Korea,,617640,Public Utilities,Telecommunications Equipment
KTB,Kontoor Brands Inc. Common Stock ,$56.87,-1.49,-2.553%,3277503121.00,,2019,281776,Consumer Non-Durables,Apparel
KTF,DWS Municipal Income Trust,$12.44,0.04,0.323%,491391669.00,United States,1988,54523,Finance,Finance Companies
KTH,Structures Products Cp 8% CorTS Issued by Peco Energy Cap Tr II Preferred Stock,$33.73,0.23,0.687%,0.00,United States,,2050,Finance,Investment Managers
KTN,Structured Products Corp 8.205% CorTS 8.205% Corporate Backed Trust Securities (CorTS),$32.1606,-0.2994,-0.922%,0.00,United States,,717,,
