Symbol,Name,Last Sale,Net Change,% Change,Market Cap,Country,IPO Year,Volume,Sector,Industry
PGP,Pimco Global Stocksplus & Income Fund Pimco Global StocksPlus & Income Fund Common Shares of Beneficial Interest,$11.04,-0.03,-0.271%,122258517.00,United States,2005,24929,Finance,Finance Companies
PGR,Progressive Corporation (The) Common Stock,$97.79,-2.09,-2.093%,57236487000.00,United States,,3250969,Finance,Property-Casualty Insurers
PGRE,Paramount Group Inc. Common Stock,$9.98,-0.27,-2.634%,2185126948.00,United States,2014,919090,Consumer Services,Real Estate Investment Trusts
PGTI,PGT Innovations Inc.,$22.38,-0.56,-2.441%,1332612781.00,United States,2006,252977,Capital Goods,Building Products
PGZ,Principal Real Estate Income Fund Common Shares of Beneficial Interest,$15.48,-0.02,-0.129%,106290665.00,,2013,22423,Finance,Investment Managers
PH,Parker-Hannifin Corporation Common Stock,$309.80,-3.59,-1.146%,39981531761.00,United States,,675591,Capital Goods,Office Equipment/Supplies/Services
PHD,Pioneer Floating Rate Fund Inc.,$11.93,-0.04,-0.334%,295126416.00,United States,2004,36217,Finance,Investment Managers
PHG,Koninklijke Philips N.V. NY Registry Shares,$46.22,-0.46,-0.985%,42128340343.00,Netherlands,,1024262,Health Care,Biotechnology: Electromedical & Electrotherapeutic Apparatus
PHI,PLDT Inc. Sponsored ADR,$25.43,-0.03,-0.118%,5494298358.00,Philippines,,54079,Public Utilities,Telecommunications Equipment
PHK,Pimco High Income Fund Pimco High Income Fund,$7.00,0.02,0.287%,935192559.00,United States,2003,450214,Finance,Finance/Investors Services
PHM,PulteGroup Inc. Common Stock,$51.67,-1.49,-2.803%,13587459472.00,United States,,2287153,,
PHR,Phreesia Inc. Common Stock,$65.66,-1.95,-2.884%,3317118381.00,United States,2019,364619,Health Care,Managed Health Care
PHT,Pioneer High Income Fund Inc.,$9.96,0.01,0.101%,291148439.00,United States,,90166,Finance,Investment Managers
PHX,PHX Minerals Inc. Common Stock,$3.32,-0.13,-3.768%,100931878.00,United States,,256960,Energy,Oil & Gas Production
PIAI,Prime Impact Acquisition I Class A Ordinary Shares,$9.77,0.01,0.102%,331259813.00,,2020,7528,Finance,Business Services
PICC,Pivotal Investment Corporation III Class A Common Stock,$9.78,-0.02,-0.204%,337410000.00,,2021,1639,,
PII,Polaris Inc. Common Stock,$130.67,-5.05,-3.721%,8002502071.00,United States,,650506,Consumer Non-Durables,Recreational Products/Toys
PIM,Putnam Master Intermediate Income Trust Common Stock,$4.24,0.03,0.713%,216976513.00,United States,1988,91408,Finance,Finance Companies
PINE,Alpine Income Property Trust Inc. Common Stock,$19.58,0.01,0.051%,212772061.00,United States,2019,100877,Consumer Services,Real Estate Investment Trusts
PING,Ping Identity Holding Corp. Common Stock,$23.23,-0.51,-2.148%,1906873228.00,United States,2019,579024,Technology,EDP Services
PINS,Pinterest Inc. Class A Common Stock,$72.11,-1.23,-1.677%,45924044258.00,,2019,12354057,,
PIPP,Pine Island Acquisition Corp. Class A Common Stock,$9.78,-0.02,-0.204%,266979330.00,United States,2021,53160,,
PIPR,Piper Sandler Companies Common Stock,$124.74,-3.01,-2.356%,1793063280.00,United States,,95750,Finance,Investment Bankers/Brokers/Service
PJT,PJT Partners Inc. Class A Common Stock,$73.82,1.20,1.652%,3042888747.00,United States,2015,186342,Finance,Investment Managers
PK,Park Hotels & Resorts Inc. Common Stock ,$18.87,-0.88,-4.456%,4462575961.00,United States,2016,3436626,Consumer Services,Real Estate Investment Trusts
PKE,Park Aerospace Corp. Common Stock,$15.63,-0.15,-0.951%,318584352.00,United States,,62713,,
PKG,Packaging Corporation of America Common Stock,$137.49,-1.42,-1.022%,13060734134.00,United States,2000,480549,Basic Industries,Paper
PKI,PerkinElmer Inc. Common Stock,$153.15,-1.42,-0.919%,17166763451.00,United States,,497122,Health Care,Medical Specialities
PKO,Pimco Income Opportunity Fund Common Shares of Beneficial Interest,$26.57,0.13,0.492%,551847315.00,United States,,63244,Finance,Finance/Investors Services
PKX,POSCO Common Stock,$74.60,-1.13,-1.492%,22566670685.00,South Korea,1994,104274,Basic Industries,Steel/Iron Ore
PLAN,Anaplan Inc. Common Stock,$54.45,1.54,2.911%,7880657890.00,United States,2018,2285547,Technology,Computer Software: Prepackaged Software
PLD,Prologis Inc. Common Stock,$125.61,-1.80,-1.413%,92922886530.00,United States,,1811293,Consumer Services,Real Estate Investment Trusts
PLNT,Planet Fitness Inc. Common Stock,$73.44,-0.36,-0.488%,6358839340.00,United States,2015,1619828,Consumer Services,Other Consumer Services
PLOW,Douglas Dynamics Inc. Common Stock,$39.65,-0.91,-2.244%,910184465.00,United States,2010,73137,Capital Goods,Construction/Ag Equipment/Trucks
PLTR,Palantir Technologies Inc. Class A Common Stock,$22.45,-0.50,-2.179%,42207731097.00,,2020,24668898,Technology,Retail: Computer Software & Peripheral Equipment
PLYM,Plymouth Industrial REIT Inc. Common Stock,$20.97,-0.31,-1.457%,616619054.00,United States,2017,138774,Consumer Services,Real Estate Investment Trusts
PM,Philip Morris International Inc Common Stock,$97.71,-0.84,-0.852%,152284649977.00,United States,,5129104,Consumer Non-Durables,Farming/Seeds/Milling
PMF,PIMCO Municipal Income Fund Common Stock,$15.17,0.03,0.198%,393524970.00,United States,2001,29348,Finance,Finance/Investors Services
PML,Pimco Municipal Income Fund II Common Shares of Beneficial Interest,$15.18,0.06,0.397%,956021220.00,United States,2002,82792,Finance,Investment Managers
PMM,Putnam Managed Municipal Income Trust Common Stock,$8.66,-0.04,-0.46%,423300809.00,United States,1989,62738,Finance,Investment Managers
PMO,Putnam Municipal Opportunities Trust Common Stock,$14.24,0.00,0.00%,485721929.00,United States,1993,49126,Finance,Finance Companies
PMT,PennyMac Mortgage Investment Trust Common Shares of Beneficial Interest,$20.51,-0.46,-2.194%,2008159717.00,United States,2009,1315928,Consumer Services,Real Estate Investment Trusts
PMT^A,PennyMac Mortgage Investment Trust 8.125% Series A Fixed-to-Floating Rate Cumulative Redeemable Preferred Shares of Beneficial Interest,$26.80,0.05,0.187%,,United States,,10042,,
PMT^B,PennyMac Mortgage Investment Trust 8.00% Series B Fixed-to-Floating Rate Cumulative Redeemable Preferred Shares of Beneficial Interest,$27.00,-0.25,-0.917%,,United States,,5352,,
PMVC,PMV Consumer Acquisition Corp. Class A Common Stock,$9.77,0.05,0.514%,213718750.00,United States,2020,4601,,
PMX,PIMCO Municipal Income Fund III Common Shares of Beneficial Interest,$12.9805,-0.0195,-0.15%,430368478.00,United States,2002,32839,Finance,Trusts Except Educational Religious and Charitable
PNC,PNC Financial Services Group Inc. (The) Common Stock,$189.28,-2.63,-1.37%,80417188299.00,United States,,1544671,Finance,Major Banks
PNC^P,PNC Financial Services Group Inc. (The) Depositary Shares Representing 1/4000th Perpetual Preferred Series P,$26.35,-0.10,-0.378%,,United States,,91800,,
PNF,PIMCO New York Municipal Income Fund Common Stock,$13.11,0.1388,1.07%,102638190.00,United States,2001,2387,Finance,Finance Companies
PNI,Pimco New York Municipal Income Fund II Common Shares of Beneficial Interest,$11.99,0.03,0.251%,134156110.00,United States,2002,11868,Finance,Trusts Except Educational Religious and Charitable
PNM,PNM Resources Inc. (Holding Co.) Common Stock,$48.56,-0.14,-0.287%,4168141481.00,United States,,384265,Public Utilities,Electric Utilities: Central
PNR,Pentair plc. Ordinary Share,$69.87,-0.51,-0.725%,11612512220.00,Switzerland,,820640,Capital Goods,Fluid Controls
PNTM,Pontem Corporation Class A Ordinary Shares,$9.69,-0.005,-0.052%,835762500.00,,2021,248702,Finance,Business Services
PNW,Pinnacle West Capital Corporation Common Stock,$83.10,-0.68,-0.812%,9369604942.00,United States,,348503,Public Utilities,Electric Utilities: Central
POLY,Plantronics Inc. Common Stock,$35.21,-0.52,-1.455%,1489215436.00,United States,,201782,Public Utilities,Telecommunications Equipment
POND,Angel Pond Holdings Corporation Class A Ordinary Shares,$9.65,0.00,0.00%,0.00,,2021,201800,,
POR,Portland General Electric Co Common Stock,$46.13,-0.17,-0.367%,4133513617.00,United States,,380379,Public Utilities,Electric Utilities: Central
POST,Post Holdings Inc. Common Stock,$106.70,-2.85,-2.602%,6789302541.00,United States,2012,275149,Consumer Non-Durables,Specialty Foods
PPG,PPG Industries Inc. Common Stock,$169.94,-2.14,-1.244%,40291274959.00,United States,,664891,Basic Industries,Paints/Coatings
PPL,PPL Corporation Common Stock,$27.93,-0.44,-1.551%,21490120660.00,United States,,3492560,Public Utilities,Electric Utilities: Central
PPT,Putnam Premier Income Trust Common Stock,$4.73,0.05,1.068%,483463436.00,United States,1988,286613,Finance,Finance Companies
PPX,PPL Capital Funding Inc. 2013 Series B Junior Subordinated Notes due 2073,$25.31,-0.03,-0.118%,0.00,,,31498,Public Utilities,Electric Utilities: Central
PQG,PQ Group Holdings Inc. Common Stock,$15.25,-0.09,-0.587%,2088097985.00,United States,2017,362971,Basic Industries,Major Chemicals
PRA,ProAssurance Corporation Common Stock,$21.22,-0.45,-2.077%,1144891127.00,United States,,215454,Finance,Property-Casualty Insurers
PRE^J,PartnerRe Ltd. 4.875% Fixed Rate Non-Cumulative Redeemable Preferred Shares Series J,$27.60,-0.105,-0.379%,,Bermuda,,8667,,
PRG,PROG Holdings Inc. Common Stock,$45.24,-0.09,-0.199%,3063621494.00,United States,,539520,Technology,Diversified Commercial Services
PRGO,Perrigo Company plc Ordinary Shares,$46.01,-0.52,-1.118%,6144592435.00,United States,,844042,Health Care,Major Pharmaceuticals
PRI,Primerica Inc. Common Stock,$146.27,-1.65,-1.115%,5768590555.00,United States,2010,73028,Finance,Life Insurance
PRIF^A,Priority Income Fund Inc. 6.375% Series A Term Preferred Stock due 2025,$25.13,-0.0267,-0.106%,,,,400,,
PRIF^E,Priority Income Fund Inc. 6.375% Series E Preferred Stock Due 2024,$25.30,-0.0025,-0.01%,,,,2604,,
PRIF^F,Priority Income Fund Inc. 6.625% Series F Term Preferred Stock due 2027,$25.70,-0.205,-0.791%,,,,1625,,
PRIF^G,Priority Income Fund Inc. 6.25% Series G Preferred Stock Due 2026,$25.62,-0.39,-1.499%,,,,2300,,
PRIF^H,Priority Income Fund Inc. 6.00% Series H Term Preferred Stock due 2026,$25.4999,-0.0011,-0.004%,,,,650,,
PRIF^I,Priority Income Fund Inc. 6.125% Series I Term Preferred Stock due 2028,$25.46,-0.02,-0.078%,,,,3325,,
PRLB,Proto Labs Inc. Common stock,$89.40,-0.85,-0.942%,2475463292.00,United States,2012,216654,Capital Goods,Office Equipment/Supplies/Services
PRMW,Primo Water Corporation Common Stock,$16.37,-0.08,-0.486%,2637733050.00,Canada,,611564,Consumer Non-Durables,Beverages (Production/Distribution)
PRO,PROS Holdings Inc. Common Stock,$45.33,-0.57,-1.242%,2005981962.00,United States,2007,106995,Technology,EDP Services
PROS,ProSight Global Inc. Common Stock,$12.78,-0.01,-0.078%,559499658.00,United States,2019,22233,Finance,Property-Casualty Insurers
PRPB,CC Neuberger Principal Holdings II Class A Ordinary Shares,$9.83,-0.02,-0.203%,1066555000.00,United States,2020,274208,Finance,Business Services
PRPC,CC Neuberger Principal Holdings III Class A Ordinary Shares,$9.75,0.00,0.00%,539296875.00,,2021,963,Finance,Business Services
PRS,Prudential Financial Inc. 5.625% Junior Subordinated Notes due 2058,$27.96,-0.14,-0.498%,952361413.00,United States,2018,31993,Finance,Investment Bankers/Brokers/Service
PRT,PermRock Royalty Trust Trust Units,$7.23,0.00,0.00%,87958242.00,United States,2018,18846,Energy,Oil & Gas Production
PRTY,Party City Holdco Inc. Common Stock,$9.05,-0.10,-1.093%,1007235099.00,United States,2015,1292830,Miscellaneous,Diversified Commercial Services
PRU,Prudential Financial Inc. Common Stock,$100.14,-1.48,-1.456%,39455160000.00,United States,2001,1512282,Finance,Life Insurance
PSA,Public Storage Common Stock,$310.28,-3.46,-1.103%,54292217279.00,United States,,622702,Consumer Services,Real Estate Investment Trusts
PSA^D,Public Storage Depositary Shares Each Representing 1/1000 of a 4.95% Cumulative Preferred Share of Beneficial Interest Series D,$25.05,-0.02,-0.08%,,United States,,21259,,
PSA^E,Public Storage Depositary Shares Each Representing 1/1000 of a 4.90% Cumulative Preferred Share of Beneficial Interest Series E,$25.59,0.04,0.157%,,United States,,11390,,
PSA^F,Public Storage Depositary Shares Each Representing 1/1000 of a 5.15% Cumulative Preferred Share of Beneficial Interest Series F par value $0.01 per share,$26.59,0.02,0.075%,,United States,,17801,,
PSA^G,Public Storage Depositary Shares Each Representing 1/1000 of a 5.05% Cumulative Preferred Share of Beneficial Interest Series G,$26.19,-0.015,-0.057%,,United States,,12248,,
PSA^H,Public Storage Depositary Shares Each Representing 1/1000 of a  5.60% Cumulative Preferred  Share of Beneficial Interest Series H,$28.38,-0.046,-0.162%,,United States,,18629,,
PSA^I,Public Storage Depositary Shares Each Representing 1/1000 of a 4.875% Cumulative Preferred Share of Beneficial Interest Series I par value $0.01 per share,$27.50,-0.10,-0.362%,,United States,,28629,,
PSA^J,Public Storage Depositary Shares Each Representing 1/1000 of a 4.700% Cumulative Preferred Share of Beneficial Interest Series J par value $0.01 per share,$27.65,-0.235,-0.843%,,United States,,81186,,
PSA^K,Public Storage Depositary Shares Each Representing 1/1000 of a 4.75% Cumulative Preferred Share of Beneficial Interest Series K,$27.54,-0.18,-0.649%,,United States,,10168,,
PSA^L,Public Storage Depositary Shares Each Representing 1/1000 of a 4.625% Cumulative Preferred Share of Beneficial Interest Series L par value $0.01 per share,$27.50,-0.24,-0.865%,,United States,,51177,,
PSA^M,Public Storage Depositary Shares Each Representing 1/1000 of a 4.125% Cumulative Preferred Share of Beneficial Interest Series M,$26.24,-0.05,-0.19%,,United States,,27198,,
PSA^N,Public Storage Depositary Shares Each Representing 1/1000 of a 3.875% Cumulative Preferred Share of Beneficial Interest Series N,$25.75,-0.02,-0.078%,,United States,,28803,,
PSA^O,Public Storage Depositary Shares Each Representing 1/1000 of a 3.900% Cumulative Preferred Share of Beneficial Interest Series O,$26.50,0.00,0.00%,,United States,,12297,,
PSA^P,Public Storage Depositary Shares Each Representing 1/1000 of a 4.000% Cumulative Preferred Share of Bene cial Interest Series P,$25.31,-0.11,-0.433%,,United States,,203114,,
PSB,PS Business Parks Inc. (MD) Common Stock,$152.35,-2.06,-1.334%,4194044216.00,United States,,52895,Consumer Services,Real Estate Investment Trusts
PSB^W,PS Business Parks Inc. Depositary Shares Each Representing 1/1000 of a Share of 5.20% Cumulative Preferred Stock Series W,$25.39,0.01,0.039%,,United States,,10226,,
PSB^X,PS Business Parks Inc. Depositary Shares Each Representing 1/1000 of a Share of 5.25% Cumulative Preferred Stock Series X,$26.5018,-0.1482,-0.556%,,United States,,21251,,
PSB^Y,PS Business Parks Inc. 5.20% Cumulative Preferred Stock Series Y,$26.92,0.07,0.261%,,United States,,3660,,
PSB^Z,PS Business Parks Inc. Depositary Shares Each Representing 1/1000 of a Share of 4.875% Cumulative Preferred Stock Series Z  par value $0.01 per share,$27.84,-0.04,-0.143%,,United States,,10481,,
PSF,Cohen & Steers Select Preferred and Income Fund Inc. Common Stock,$31.68,0.03,0.095%,380685508.00,,2010,22296,Finance,Investment Managers
PSFE,Paysafe Limited Common Shares,$10.99,-0.51,-4.435%,7953599078.00,,2021,4233895,Miscellaneous,Business Services
PSN,Parsons Corporation Common Stock,$40.22,-0.47,-1.155%,4118874214.00,,2019,235483,Technology,EDP Services
PSO,Pearson Plc Common Stock,$11.54,-0.04,-0.345%,8726949454.00,United Kingdom,,181642,Consumer Services,Books
PSTG,Pure Storage Inc. Class A Common Stock,$18.58,-0.31,-1.641%,5262876153.00,,2015,3155029,Technology,Electronic Components
PSTH,Pershing Square Tontine Holdings Ltd. Class A Common Stock,$21.41,-0.18,-0.834%,4282002141.00,,2020,1911147,,
PSTL,Postal Realty Trust Inc. Class A Common Stock,$18.48,-0.50,-2.634%,247092791.00,,2019,52378,Consumer Services,Real Estate Investment Trusts
PSX,Phillips 66 Common Stock,$81.65,-0.75,-0.91%,35751844959.00,United States,,3340164,Energy,Integrated oil Companies
PSXP,Phillips 66 Partners LP Common Units representing limited partner interest in the Partnership,$38.39,-0.72,-1.841%,8765978205.00,United States,2013,408561,Energy,Oil & Gas Production
PTA,Cohen & Steers Tax-Advantaged Preferred Securities and Income Fund Common Shares of Beneficial Interest,$25.67,-0.12,-0.465%,1418869641.00,,2020,102034,Finance,Trusts Except Educational Religious and Charitable
PTR,PetroChina Company Limited Common Stock,$45.11,0.43,0.962%,82560763086.00,China,,246284,Energy,Oil & Gas Production
PTY,Pimco Corporate & Income Opportunity Fund,$20.12,-0.02,-0.099%,2225608225.00,United States,2002,415605,Finance,Investment Managers
PUK,Prudential Public Limited Company Common Stock,$37.69,-0.60,-1.567%,49291187825.00,United Kingdom,,154470,Finance,Life Insurance
PUK^,Prudential Public Limited Company 6.75% Perpetual Subordinated Captial Security,$27.06,-0.1796,-0.659%,,United Kingdom,,22000,,
PUK^A,Prudential Public Limited Company 6.50% Perpetual Subordinated Capital Securities Exchangeable at the Issuer's Option Into Non-Cumulative Dollar Denominated Preference Shares,$26.90,-0.17,-0.628%,,United Kingdom,,20007,,
PUMP,ProPetro Holding Corp. Common Stock,$8.83,-0.16,-1.78%,903135323.00,United States,2017,538886,Energy,Oilfield Services/Equipment
PV,Primavera Capital Acquisition Corporation Class A Ordinary Shares,$9.68,0.01,0.103%,520300000.00,,2021,41099,Finance,Business Services
PVG,Pretium Resources Inc. Ordinary Shares (Canada),$9.25,0.06,0.653%,1737456027.00,Canada,,1033222,,
PVH,PVH Corp. Common Stock,$104.67,-3.06,-2.84%,7469222939.00,United States,,734386,,
PVL,Permianville Royalty Trust Trust Units ,$1.98,0.03,1.538%,65340000.00,United States,2011,56647,Energy,Oil & Gas Production
PWR,Quanta Services Inc. Common Stock,$89.74,-0.89,-0.982%,12504918296.00,United States,,688146,Capital Goods,Engineering & Construction
PXD,Pioneer Natural Resources Company Common Stock,$157.19,0.13,0.083%,38346877913.00,United States,,1606185,Energy,Oil & Gas Production
PYN,PIMCO New York Municipal Income Fund III Common Shares of Beneficial Interest,$10.48,0.02,0.191%,60029440.00,United States,2002,7227,Finance,Investment Managers
PYS,Merrill Lynch Depositor Inc PPlus Tr Ser RRD-1 Tr Ctf Cl A,$22.4899,-0.2001,-0.882%,0.00,United States,,1001,Finance,Trusts Except Educational Religious and Charitable
PYT,PPlus Tr GSC-2 Tr Ctf Fltg Rate,$24.12,0.00,0.00%,0.00,United States,,15,,
PZC,PIMCO California Municipal Income Fund III Common Shares of Beneficial Interest,$11.65,0.04,0.345%,260738650.00,United States,2002,23797,Finance,Investment Managers
PZN,Pzena Investment Management Inc Class A Common Stock,$10.98,0.08,0.734%,796791359.00,United States,2007,66096,Finance,Investment Managers
QD,Qudian Inc. American Depositary Shares each representing one Class A Ordinary Share,$2.03,0.03,1.50%,513769042.00,China,2017,1982626,Technology,Computer Software: Prepackaged Software
QFTA,Quantum FinTech Acquisition Corporation Common Stock,$9.76,0.00,0.00%,245525000.00,,2021,17,,
QGEN,Qiagen N.V. Common Shares ,$47.14,-1.65,-3.382%,10767105980.00,Netherlands,,1533816,Health Care,Biotechnology: Biological Products (No Diagnostic Substances)
QS,QuantumScape Corporation Class A Common Stock,$23.26,-0.99,-4.082%,9442953914.00,United States,2020,10769085,Capital Goods,Auto Parts:O.E.M.
QSR,Restaurant Brands International Inc. Common Shares,$63.92,-0.43,-0.668%,19374999515.00,Canada,2014,778712,,
QTS,QTS Realty Trust Inc. Class A Common Stock,$77.48,-0.07,-0.09%,5301911229.00,United States,2013,1256074,Consumer Services,Real Estate Investment Trusts
QTS^A,QTS Realty Trust Inc. 7.125% Series A Cumulative Redeemable Perpetual Preferred Stock,$25.68,-0.0099,-0.039%,,United States,,19460,,
QTS^B,QTS Realty Trust Inc. 6.50% Series B Cumulative Convertible Perpetual Preferred Stock,$171.21,0.03,0.018%,,United States,,11163,,
QTWO,Q2 Holdings Inc. Common Stock,$102.18,0.02,0.02%,5753276576.00,,2014,268303,Technology,EDP Services
QUAD,Quad Graphics Inc Class A Common Stock,$3.82,-0.10,-2.551%,208879151.00,United States,,305331,Consumer Services,Advertising
QUOT,Quotient Technology Inc. Common Stock,$10.55,-0.35,-3.211%,984973637.00,,2014,348825,Technology,Advertising
QVCC,QVC Inc. 6.250% Senior Secured Notes due 2068,$26.47,0.09,0.341%,0.00,United States,2019,48858,,
QVCD,QVC Inc. 6.375% Senior Secured Notes due 2067,$26.25,-0.04,-0.152%,0.00,United States,2018,18090,,
R,Ryder System Inc. Common Stock,$73.96,-0.53,-0.712%,3984253823.00,United States,,620621,Miscellaneous,Rental/Leasing Companies
RA,Brookfield Real Assets Income Fund Inc. Common Stock,$22.28,-0.25,-1.11%,977933879.00,,2016,246477,Finance,Investment Managers
RAAS,Cloopen Group Holding Limited American Depositary Shares each representing two Class A Ordinary Shares,$6.16,-0.19,-2.992%,1012520272.00,,2021,572203,Technology,Computer Software: Prepackaged Software
RACE,Ferrari N.V. Common Shares,$209.66,0.08,0.038%,51951206501.00,,2015,108554,Capital Goods,Auto Manufacturing
RAD,Rite Aid Corporation Common Stock,$14.15,-0.61,-4.133%,779717949.00,United States,,2073928,Health Care,Medical/Nursing Services
RAMP,LiveRamp Holdings Inc. Common Stock,$41.17,-1.62,-3.786%,2813154787.00,United States,2018,658501,Technology,EDP Services
RBA,Ritchie Bros. Auctioneers Incorporated Common Stock,$59.50,-0.03,-0.05%,6561696355.00,Canada,,216203,,
RBAC,RedBall Acquisition Corp. Class A Ordinary Shares,$9.80,0.00,0.00%,704375000.00,United States,2020,159954,Finance,Business Services
RBC,Regal Beloit Corporation Common Stock,$131.64,-2.08,-1.555%,5348522011.00,United States,,183516,Consumer Durables,Metal Fabrications
RBLX,Roblox Corporation Class A Common Stock,$84.02,-2.52,-2.912%,47877239521.00,,2021,9183441,Technology,EDP Services
RC,Ready Capital Corproation Common Stock,$15.18,-0.43,-2.755%,1081145391.00,United States,2013,260070,Consumer Services,Real Estate Investment Trusts
RC^B,Ready Capital Corporation 8.625% Series B Cumulative Preferred Stock,$24.9902,-0.0097,-0.039%,,United States,,1773,,
RC^C,Ready Capital Corporation 6.25% Series C Cumulative Convertible Preferred Stock,$25.6979,0.1679,0.658%,,United States,,1047,,
RC^D,Ready Capital Corporation 7.625% Series D Cumulative Redeemable Preferred Stock,$24.9902,0.0001,0.00%,,United States,,6342,,
RC^E,Ready Capital Corporation 6.50% Series E Cumulative Redeemable Preferred Stock,$25.11,-0.13,-0.515%,,United States,,47014,,
RCA,Ready Capital Corporation 7.00% Convertible Senior Notes due 2023,$26.73,-0.26,-0.963%,0.00,United States,2017,17521,Consumer Services,Real Estate Investment Trusts
RCB,Ready Capital Corporation 6.20% Senior Notes due 2026,$26.20,-0.21,-0.795%,0.00,United States,2019,1587,,
RCC,Ready Capital Corporation 5.75% Senior Notes due 2026,$26.18,-0.23,-0.871%,,United States,2021,62739,Finance,Finance Companies
RCI,Rogers Communication Inc. Common Stock,$53.34,-0.02,-0.037%,26932716462.00,Canada,,179887,Consumer Services,Television Services
RCL,D/B/A Royal Caribbean Cruises Ltd. Common Stock,$78.51,-3.03,-3.716%,19986342281.00,United States,1993,2880689,,
RCS,PIMCO Strategic Income Fund Inc.,$7.59,-0.05,-0.654%,336471349.00,United States,1994,78135,Finance,Investment Managers
RCUS,Arcus Biosciences Inc. Common Stock,$28.40,-0.93,-3.171%,2016282424.00,,2018,680197,Health Care,Major Pharmaceuticals
RDN,Radian Group Inc. Common Stock,$21.81,-0.58,-2.59%,4172614108.00,United States,,1977192,Finance,Property-Casualty Insurers
RDS/B,Royal Dutch Shell PLC,$39.22,-0.19,-0.482%,,Netherlands,,2951023,,
RDY,Dr. Reddy's Laboratories Ltd Common Stock,$73.31,-0.81,-1.093%,12153693438.00,India,,88304,Health Care,Major Pharmaceuticals
RE,Everest Re Group Ltd. Common Stock,$244.67,-4.23,-1.699%,9807236062.00,Bermuda,,155345,Finance,Property-Casualty Insurers
RELX,RELX PLC PLC American Depositary Shares (Each representing One Ordinary Share),$28.38,0.15,0.531%,54867248999.00,United Kingdom,2015,551480,Consumer Services,Publishing
RENN,Renren Inc. American Depositary Shares each representing fifteen Class A ordinary shares,$11.47,-0.02,-0.174%,275502013.00,China,2011,23524,Technology,EDP Services
RERE,AiHuiShou International Co. Ltd. American Depositary Shares (every three of which representing two Class A ordinary shares),$14.04,0.04,0.286%,3125793097.00,,2021,430906,,
RES,RPC Inc. Common Stock,$4.97,-0.02,-0.401%,1072203069.00,United States,,651646,Energy,Oilfield Services/Equipment
REV,Revlon Inc. New Common Stock,$11.82,-0.59,-4.754%,632208917.00,United States,1996,155850,Consumer Non-Durables,Package Goods/Cosmetics
REVG,REV Group Inc. Common Stock,$15.98,-0.66,-3.966%,1034575498.00,United States,2017,583044,Capital Goods,Auto Manufacturing
REX,REX American Resources Corporation,$85.59,-1.14,-1.314%,512855280.00,United States,,26245,Basic Industries,Automotive Aftermarket
REXR,Rexford Industrial Realty Inc. Common Stock,$58.38,-0.85,-1.435%,7826559935.00,United States,2013,467702,Consumer Services,Real Estate Investment Trusts
REXR^A,Rexford Industrial Realty Inc. 5.875% Series A Cumulative Redeemable Preferred Stock,$25.13,-0.07,-0.278%,,United States,,333472,,
REXR^B,Rexford Industrial Realty Inc. 5.875% Series B Cumulative Redeemable Preferred Stock,$26.30,-0.245,-0.923%,,United States,,8240,,
REXR^C,Rexford Industrial Realty Inc. 5.625% Series C Cumulative Redeemable Preferred Stock par value $0.01 per share,$27.7421,0.1521,0.551%,,United States,,261,,
REZI,Resideo Technologies Inc. Common Stock ,$28.46,-1.28,-4.304%,4093982185.00,,2018,493430,Miscellaneous,Diversified Manufacture
RF,Regions Financial Corporation Common Stock,$19.72,-0.31,-1.548%,18956548009.00,United States,,7070090,Finance,Major Banks
RF^B,Regions Financial Corporation Depositary Shares Representing 1/40th Perpetual Preferred Series B,$28.84,-0.24,-0.825%,,United States,,48037,,
